{"$schema":"https://json-schema.org/draft/2020-12/schema","$id":"https://playaig.com/schemas/class.schema.json","type":"object","additionalProperties":false,"required":["id","slug","name","shortDescription","description","status","verificationStatus","sourceIds","gameVersionId","imageAssetIds","createdAt","updatedAt","lastVerifiedAt","notes","classType","parentClassId","roleIds","weaponTypeIds","primaryStatIds","secondaryStatIds","skillIds","advancedClassIds","recommendedBuildIds","strengths","weaknesses","playstyle","difficulty"],"properties":{"id":{"type":"string","pattern":"^[a-z][a-z0-9]*(?:-[a-z0-9]+)*$"},"slug":{"type":"string","pattern":"^[a-z0-9]+(?:-[a-z0-9]+)*$"},"name":{"type":"string","minLength":1},"shortDescription":{"type":["string","null"]},"description":{"type":["string","null"]},"status":{"enum":["draft","review","published","archived"]},"verificationStatus":{"enum":["verified","partially-verified","unverified"]},"sourceIds":{"type":"array","items":{"type":"string","pattern":"^[a-z][a-z0-9]*(?:-[a-z0-9]+)*$"},"uniqueItems":true},"gameVersionId":{"type":["string","null"],"pattern":"^[a-z][a-z0-9]*(?:-[a-z0-9]+)*$"},"imageAssetIds":{"type":"array","items":{"type":"string","pattern":"^[a-z][a-z0-9]*(?:-[a-z0-9]+)*$"},"uniqueItems":true},"createdAt":{"type":"string","format":"date-time"},"updatedAt":{"type":"string","format":"date-time"},"lastVerifiedAt":{"type":["string","null"],"format":"date-time"},"notes":{"type":["string","null"]},"classType":{"enum":["base","advanced"]},"parentClassId":{"type":["string","null"]},"roleIds":{"type":"array","items":{"type":"string"},"uniqueItems":true},"weaponTypeIds":{"type":"array","items":{"type":"string"},"uniqueItems":true},"primaryStatIds":{"type":"array","items":{"type":"string"},"uniqueItems":true},"secondaryStatIds":{"type":"array","items":{"type":"string"},"uniqueItems":true},"skillIds":{"type":"array","items":{"type":"string"},"uniqueItems":true},"advancedClassIds":{"type":"array","items":{"type":"string"},"uniqueItems":true},"recommendedBuildIds":{"type":"array","items":{"type":"string"},"uniqueItems":true},"strengths":{"type":"array","items":{"type":"string"},"uniqueItems":true},"weaknesses":{"type":"array","items":{"type":"string"},"uniqueItems":true},"playstyle":{"type":["string","null"]},"difficulty":{"type":["string","null"]}}}
