[
  {
    "id": "class-acolyte",
    "slug": "acolyte",
    "name": "Acolyte",
    "shortDescription": null,
    "description": null,
    "status": "draft",
    "verificationStatus": "partially-verified",
    "sourceIds": ["source-official-steam-store"],
    "gameVersionId": "version-unknown",
    "imageAssetIds": [],
    "createdAt": "2026-08-01T00:00:00Z",
    "updatedAt": "2026-08-01T00:00:00Z",
    "lastVerifiedAt": "2026-08-01T00:00:00Z",
    "notes": "Base-class name and base-class status are confirmed by the official Steam store. No role, weapon, stat, skill, progression, difficulty, or image claim is recorded.",
    "classType": "base",
    "parentClassId": null,
    "roleIds": [],
    "weaponTypeIds": [],
    "primaryStatIds": [],
    "secondaryStatIds": [],
    "skillIds": [],
    "advancedClassIds": [],
    "recommendedBuildIds": [],
    "strengths": [],
    "weaknesses": [],
    "playstyle": null,
    "difficulty": null
  },
  {
    "id": "class-mage",
    "slug": "mage",
    "name": "Mage",
    "shortDescription": null,
    "description": null,
    "status": "draft",
    "verificationStatus": "partially-verified",
    "sourceIds": ["source-official-steam-store"],
    "gameVersionId": "version-unknown",
    "imageAssetIds": [],
    "createdAt": "2026-08-01T00:00:00Z",
    "updatedAt": "2026-08-01T00:00:00Z",
    "lastVerifiedAt": "2026-08-01T00:00:00Z",
    "notes": "Base-class name and base-class status are confirmed by the official Steam store. No role, weapon, stat, skill, progression, difficulty, or image claim is recorded.",
    "classType": "base",
    "parentClassId": null,
    "roleIds": [],
    "weaponTypeIds": [],
    "primaryStatIds": [],
    "secondaryStatIds": [],
    "skillIds": [],
    "advancedClassIds": [],
    "recommendedBuildIds": [],
    "strengths": [],
    "weaknesses": [],
    "playstyle": null,
    "difficulty": null
  },
  {
    "id": "class-summoner",
    "slug": "summoner",
    "name": "Summoner",
    "shortDescription": null,
    "description": null,
    "status": "draft",
    "verificationStatus": "partially-verified",
    "sourceIds": ["source-official-steam-store"],
    "gameVersionId": "version-unknown",
    "imageAssetIds": [],
    "createdAt": "2026-08-01T00:00:00Z",
    "updatedAt": "2026-08-01T00:00:00Z",
    "lastVerifiedAt": "2026-08-01T00:00:00Z",
    "notes": "Base-class name and base-class status are confirmed by the official Steam store. No role, weapon, stat, skill, progression, difficulty, or image claim is recorded.",
    "classType": "base",
    "parentClassId": null,
    "roleIds": [],
    "weaponTypeIds": [],
    "primaryStatIds": [],
    "secondaryStatIds": [],
    "skillIds": [],
    "advancedClassIds": [],
    "recommendedBuildIds": [],
    "strengths": [],
    "weaknesses": [],
    "playstyle": null,
    "difficulty": null
  },
  {
    "id": "class-knight",
    "slug": "knight",
    "name": "Knight",
    "shortDescription": null,
    "description": null,
    "status": "draft",
    "verificationStatus": "partially-verified",
    "sourceIds": ["source-official-steam-store"],
    "gameVersionId": "version-unknown",
    "imageAssetIds": [],
    "createdAt": "2026-08-01T00:00:00Z",
    "updatedAt": "2026-08-01T00:00:00Z",
    "lastVerifiedAt": "2026-08-01T00:00:00Z",
    "notes": "Base-class name and base-class status are confirmed by the official Steam store. No role, weapon, stat, skill, progression, difficulty, or image claim is recorded.",
    "classType": "base",
    "parentClassId": null,
    "roleIds": [],
    "weaponTypeIds": [],
    "primaryStatIds": [],
    "secondaryStatIds": [],
    "skillIds": [],
    "advancedClassIds": [],
    "recommendedBuildIds": [],
    "strengths": [],
    "weaknesses": [],
    "playstyle": null,
    "difficulty": null
  },
  {
    "id": "class-warrior",
    "slug": "warrior",
    "name": "Warrior",
    "shortDescription": null,
    "description": null,
    "status": "draft",
    "verificationStatus": "partially-verified",
    "sourceIds": ["source-official-steam-store"],
    "gameVersionId": "version-unknown",
    "imageAssetIds": [],
    "createdAt": "2026-08-01T00:00:00Z",
    "updatedAt": "2026-08-01T00:00:00Z",
    "lastVerifiedAt": "2026-08-01T00:00:00Z",
    "notes": "Base-class name and base-class status are confirmed by the official Steam store. No role, weapon, stat, skill, progression, difficulty, or image claim is recorded.",
    "classType": "base",
    "parentClassId": null,
    "roleIds": [],
    "weaponTypeIds": [],
    "primaryStatIds": [],
    "secondaryStatIds": [],
    "skillIds": [],
    "advancedClassIds": [],
    "recommendedBuildIds": [],
    "strengths": [],
    "weaknesses": [],
    "playstyle": null,
    "difficulty": null
  },
  {
    "id": "class-scout",
    "slug": "scout",
    "name": "Scout",
    "shortDescription": null,
    "description": null,
    "status": "draft",
    "verificationStatus": "partially-verified",
    "sourceIds": ["source-official-steam-store"],
    "gameVersionId": "version-unknown",
    "imageAssetIds": [],
    "createdAt": "2026-08-01T00:00:00Z",
    "updatedAt": "2026-08-01T00:00:00Z",
    "lastVerifiedAt": "2026-08-01T00:00:00Z",
    "notes": "Base-class name and base-class status are confirmed by the official Steam store. No role, weapon, stat, skill, progression, difficulty, or image claim is recorded.",
    "classType": "base",
    "parentClassId": null,
    "roleIds": [],
    "weaponTypeIds": [],
    "primaryStatIds": [],
    "secondaryStatIds": [],
    "skillIds": [],
    "advancedClassIds": [],
    "recommendedBuildIds": [],
    "strengths": [],
    "weaknesses": [],
    "playstyle": null,
    "difficulty": null
  },
  {
    "id": "class-rogue",
    "slug": "rogue",
    "name": "Rogue",
    "shortDescription": null,
    "description": null,
    "status": "draft",
    "verificationStatus": "partially-verified",
    "sourceIds": ["source-official-steam-store"],
    "gameVersionId": "version-unknown",
    "imageAssetIds": [],
    "createdAt": "2026-08-01T00:00:00Z",
    "updatedAt": "2026-08-01T00:00:00Z",
    "lastVerifiedAt": "2026-08-01T00:00:00Z",
    "notes": "Base-class name and base-class status are confirmed by the official Steam store. No role, weapon, stat, skill, progression, difficulty, or image claim is recorded.",
    "classType": "base",
    "parentClassId": null,
    "roleIds": [],
    "weaponTypeIds": [],
    "primaryStatIds": [],
    "secondaryStatIds": [],
    "skillIds": [],
    "advancedClassIds": [],
    "recommendedBuildIds": [],
    "strengths": [],
    "weaknesses": [],
    "playstyle": null,
    "difficulty": null
  }
]
